{
  "title": "新游戏标题",
  "subtitle": "一句话副标题",
  "entryScene": "intro",
  "status": [
    {
      "key": "sanity",
      "label": "理智",
      "value": 100,
      "max": 100
    },
    {
      "key": "clueCount",
      "label": "线索",
      "value": 0,
      "max": 10
    }
  ],
  "initialState": {
    "sanity": 100,
    "clueCount": 0,
    "items": [],
    "clues": [],
    "phase": "early",
    "tags": []
  },
  "phases": [
    {
      "id": "early",
      "conditions": {
        "key": "clueCount",
        "op": "lt",
        "value": 3
      }
    },
    {
      "id": "late",
      "conditions": {
        "key": "clueCount",
        "op": "gte",
        "value": 3
      }
    }
  ],
  "collectibles": {
    "items": [
      {
        "id": "keycard",
        "name": "门禁卡",
        "description": "可以打开员工区域的基础门禁。"
      }
    ],
    "clues": [
      {
        "id": "smell_note",
        "name": "消毒水气味",
        "description": "空气中的味道像消毒水混着铁锈。"
      }
    ]
  },
  "systemRules": {
    "afterChoice": [
      {
        "id": "low-sanity",
        "when": {
          "key": "sanity",
          "op": "lte",
          "value": 20
        },
        "actions": [
          {
            "type": "addTag",
            "tag": "unstable"
          }
        ]
      }
    ],
    "choiceRules": [
      {
        "action": "disable",
        "when": {
          "key": "tags",
          "op": "includes",
          "value": "unstable"
        },
        "match": {
          "tagsAny": ["precise"]
        },
        "reason": "你现在已经不够冷静，做不出这种精细判断。"
      }
    ]
  },
  "scenes": {
    "intro": {
      "title": "开始",
      "contentBlocks": [
        {
          "type": "narrator",
          "text": "你站在故事开始的地方。"
        },
        {
          "type": "danger",
          "text": "空气里有不对劲的味道。"
        }
      ],
      "choices": [
        {
          "text": "继续前进",
          "next": "next_scene",
          "tags": ["precise"],
          "actions": [
            {
              "type": "advanceTime",
              "amount": 1
            },
            {
              "type": "adjust",
              "key": "sanity",
              "amount": -5
            },
            {
              "type": "adjust",
              "key": "clueCount",
              "amount": 1
            },
            {
              "type": "gainItem",
              "item": "keycard"
            },
            {
              "type": "gainClue",
              "clue": "smell_note"
            }
          ]
        }
      ]
    },
    "next_scene": {
      "title": "下一幕",
      "contentBlocks": [
        {
          "type": "narrator",
          "text": "这里继续写你的主线内容。"
        }
      ],
      "choices": [
        {
          "text": "返回开头",
          "next": "intro",
          "reset": true
        }
      ]
    }
  }
}
